{
  "schemaVersion": "1.0.0",
  "taskId": "T-G0-SEC",
  "sourceHashes": {
    "prd": "baa521d9c67e67a86d7ddb111c793b67462ed4c7acc89cec34ab9f5ade077299",
    "requirements": "e0f9f1284473fe097fde591138d16984ae8580feaf13333e22594717eec690ff",
    "audit": "ab4be13b6aeac998f13daa89ae08f4b9f5d6280b4018bd171b7b128b412a47f8"
  },
  "files": [
    {
      "path": "task-contract.json",
      "sha256": "91e49f9d1e9a3250c75e6ad8c8f061f10b30f854c9a733ade1938f27552cf3bb",
      "bytes": 8637
    },
    {
      "path": "requirements.json",
      "sha256": "afde72fffb5283039a484d8a46306fa1e5bf63f6e8222f4685a74efc782ebfaf",
      "bytes": 46292
    },
    {
      "path": "acceptance-criteria.json",
      "sha256": "09ffe8be17ec62c224e7d985a140ca431f4ee1d290aa01da498c45c1988bbb57",
      "bytes": 29245
    },
    {
      "path": "invariants.json",
      "sha256": "df6149df9a2b0f1a9025c52652138be5ec08b98f5468c5f0e50edca3309bf526",
      "bytes": 4019
    },
    {
      "path": "adrs.json",
      "sha256": "2a8c4d2c0edcc0bdf64aa2e44b9e396f6a5885f67c52c470ca668ed90686ce68",
      "bytes": 669
    },
    {
      "path": "architecture-boundaries.json",
      "sha256": "35e862bcbeafef342cf3cbbd06bd9c9b2c212db7f46e29f8d21038ab44444785",
      "bytes": 505
    },
    {
      "path": "dependency-outputs.json",
      "sha256": "354eac69b8bdba53200dc9d4a754dead97f3539444fe57f917e98ee50e295065",
      "bytes": 154
    },
    {
      "path": "public-schemas.json",
      "sha256": "71577b48efada42d9adb19675826dff80d4e912ee84232a5167996833bf07d98",
      "bytes": 483
    },
    {
      "path": "semantic-fields.json",
      "sha256": "54b67c0102778ddecfc62e969751e98ec17d8953596b148f6c080647b707981e",
      "bytes": 426
    },
    {
      "path": "pre-mortem.json",
      "sha256": "e72a565d750ab0204767159fbbb82ece99afdc117c064fc74d710cf6e7f5b9cb",
      "bytes": 260
    },
    {
      "path": "source-references.json",
      "sha256": "bc210811cbcb9437c8db2629c1a6c5e324fb40a4082babc005f81b001588f633",
      "bytes": 1527
    }
  ],
  "generatedAt": "2026-07-20T00:00:00Z"
}
