{
  "schemaVersion": "1.0.0",
  "taskId": "T-G6-CF",
  "sourceHashes": {
    "prd": "baa521d9c67e67a86d7ddb111c793b67462ed4c7acc89cec34ab9f5ade077299",
    "requirements": "e0f9f1284473fe097fde591138d16984ae8580feaf13333e22594717eec690ff",
    "audit": "ab4be13b6aeac998f13daa89ae08f4b9f5d6280b4018bd171b7b128b412a47f8"
  },
  "files": [
    {
      "path": "task-contract.json",
      "sha256": "b3b7655019f9c7e922661186e3e47aab5d45852fc1021fe6d4cac5abe81012dc",
      "bytes": 5613
    },
    {
      "path": "requirements.json",
      "sha256": "384612eb113e99a89e13c49ddb74730dfca5a2f408f98ccb2c1f52d2d76a719a",
      "bytes": 7009
    },
    {
      "path": "acceptance-criteria.json",
      "sha256": "7da9ffee696a197f523548b03044bb68b91108cd7c2c6ba5ddb7b888003211b5",
      "bytes": 6257
    },
    {
      "path": "invariants.json",
      "sha256": "df6149df9a2b0f1a9025c52652138be5ec08b98f5468c5f0e50edca3309bf526",
      "bytes": 4019
    },
    {
      "path": "adrs.json",
      "sha256": "2a8c4d2c0edcc0bdf64aa2e44b9e396f6a5885f67c52c470ca668ed90686ce68",
      "bytes": 669
    },
    {
      "path": "architecture-boundaries.json",
      "sha256": "8413fa5d2e6e36f6c0b01a6671a6276109a0c51e7454dace4386af8a549ff17f",
      "bytes": 497
    },
    {
      "path": "dependency-outputs.json",
      "sha256": "11b1fdec4f8091b5b2a26550605d2deefba0db1408164ccdfb3f413902c518fe",
      "bytes": 985
    },
    {
      "path": "public-schemas.json",
      "sha256": "d9bfaf9ac184963786d1643bfdc064b705c0fe604793fdc1f9b9a6bbbd35ce48",
      "bytes": 120
    },
    {
      "path": "semantic-fields.json",
      "sha256": "54b67c0102778ddecfc62e969751e98ec17d8953596b148f6c080647b707981e",
      "bytes": 426
    },
    {
      "path": "pre-mortem.json",
      "sha256": "e72a565d750ab0204767159fbbb82ece99afdc117c064fc74d710cf6e7f5b9cb",
      "bytes": 260
    },
    {
      "path": "source-references.json",
      "sha256": "c2ad61bd05087f13c6866f50453cceb604ecf8846ca375a5ea7f013c28c667ee",
      "bytes": 381
    }
  ],
  "generatedAt": "2026-07-20T00:00:00Z"
}
