{
  "schemaVersion": "1.0.0",
  "taskId": "T-G6-EVAL",
  "sourceHashes": {
    "prd": "baa521d9c67e67a86d7ddb111c793b67462ed4c7acc89cec34ab9f5ade077299",
    "requirements": "e0f9f1284473fe097fde591138d16984ae8580feaf13333e22594717eec690ff",
    "audit": "ab4be13b6aeac998f13daa89ae08f4b9f5d6280b4018bd171b7b128b412a47f8"
  },
  "files": [
    {
      "path": "task-contract.json",
      "sha256": "ea5d244eb3a819301a736e1c1bf4c0273aac6d4008ce9b6ef0df7ec01c1ea133",
      "bytes": 9166
    },
    {
      "path": "requirements.json",
      "sha256": "0c77d887fd8fb763f53c8fdfa299fe80b134268e3ea1d740e6d6bad7f153bf48",
      "bytes": 42559
    },
    {
      "path": "acceptance-criteria.json",
      "sha256": "f7566ea34f57fea5ab294b3c44a30f95f759684ebb3ef485a12e807eec11d200",
      "bytes": 35982
    },
    {
      "path": "invariants.json",
      "sha256": "df6149df9a2b0f1a9025c52652138be5ec08b98f5468c5f0e50edca3309bf526",
      "bytes": 4019
    },
    {
      "path": "adrs.json",
      "sha256": "2a8c4d2c0edcc0bdf64aa2e44b9e396f6a5885f67c52c470ca668ed90686ce68",
      "bytes": 669
    },
    {
      "path": "architecture-boundaries.json",
      "sha256": "968e37ae9191d594c14bf25e5fb8917f817f83ad1e26521bbd28a35da19e1fb9",
      "bytes": 505
    },
    {
      "path": "dependency-outputs.json",
      "sha256": "6b093d75fa2554bf2ef4a0cf40f22890452a170395c9770f1996095d2260abc1",
      "bytes": 977
    },
    {
      "path": "public-schemas.json",
      "sha256": "1299cc8da9d9cda03f8126c47cada0d6b438042aeef7a8981324d2cd5638b732",
      "bytes": 454
    },
    {
      "path": "semantic-fields.json",
      "sha256": "54b67c0102778ddecfc62e969751e98ec17d8953596b148f6c080647b707981e",
      "bytes": 426
    },
    {
      "path": "pre-mortem.json",
      "sha256": "e72a565d750ab0204767159fbbb82ece99afdc117c064fc74d710cf6e7f5b9cb",
      "bytes": 260
    },
    {
      "path": "source-references.json",
      "sha256": "73fbdc9cb295de41a53b80d47e6a51ef07a8c97e71780676f0183169a29229bb",
      "bytes": 1411
    }
  ],
  "generatedAt": "2026-07-20T00:00:00Z"
}
