{
  "schemaVersion": "1.0.0",
  "taskId": "T-G6-WPI-02",
  "sourceHashes": {
    "prd": "baa521d9c67e67a86d7ddb111c793b67462ed4c7acc89cec34ab9f5ade077299",
    "requirements": "e0f9f1284473fe097fde591138d16984ae8580feaf13333e22594717eec690ff",
    "audit": "ab4be13b6aeac998f13daa89ae08f4b9f5d6280b4018bd171b7b128b412a47f8"
  },
  "files": [
    {
      "path": "task-contract.json",
      "sha256": "51401541f01a320a95da4fd3dca79a02b44d302abaa93d8f219e1a8879fb2eb2",
      "bytes": 5734
    },
    {
      "path": "requirements.json",
      "sha256": "9cdbd1e9357c77f87ae69af667b9dd05ea74a3b2c490b1a5b29c3f06c5f89cbf",
      "bytes": 8253
    },
    {
      "path": "acceptance-criteria.json",
      "sha256": "aee2625f72701f85030a8e7ab466485279f6e95a05b7bd101bfea62a16ffe58d",
      "bytes": 2296
    },
    {
      "path": "invariants.json",
      "sha256": "df6149df9a2b0f1a9025c52652138be5ec08b98f5468c5f0e50edca3309bf526",
      "bytes": 4019
    },
    {
      "path": "adrs.json",
      "sha256": "2a8c4d2c0edcc0bdf64aa2e44b9e396f6a5885f67c52c470ca668ed90686ce68",
      "bytes": 669
    },
    {
      "path": "architecture-boundaries.json",
      "sha256": "24a0fcff077feb30eaa91114b2ffa1ad46a80b551c1eb229b66f3225a8f7a7db",
      "bytes": 490
    },
    {
      "path": "dependency-outputs.json",
      "sha256": "b0f13398e337e36543276a199c4a6872b24e0fa9feb7c21b49fa0abf1e2ce942",
      "bytes": 1263
    },
    {
      "path": "public-schemas.json",
      "sha256": "1bb78e675c9a4b0a1de85c28c4de164c2efe5e0da1dcfa8c550f9cd2b292036b",
      "bytes": 123
    },
    {
      "path": "semantic-fields.json",
      "sha256": "54b67c0102778ddecfc62e969751e98ec17d8953596b148f6c080647b707981e",
      "bytes": 426
    },
    {
      "path": "pre-mortem.json",
      "sha256": "e72a565d750ab0204767159fbbb82ece99afdc117c064fc74d710cf6e7f5b9cb",
      "bytes": 260
    },
    {
      "path": "source-references.json",
      "sha256": "04d8a1308f4b3123bea6773f5019c32cc06ca2aaa40444135e8588ea50b13994",
      "bytes": 384
    }
  ],
  "generatedAt": "2026-07-20T00:00:00Z"
}
