{
  "schemaVersion": "1.0.0",
  "taskId": "T-G4-CROWD",
  "sourceHashes": {
    "prd": "baa521d9c67e67a86d7ddb111c793b67462ed4c7acc89cec34ab9f5ade077299",
    "requirements": "e0f9f1284473fe097fde591138d16984ae8580feaf13333e22594717eec690ff",
    "audit": "ab4be13b6aeac998f13daa89ae08f4b9f5d6280b4018bd171b7b128b412a47f8"
  },
  "files": [
    {
      "path": "task-contract.json",
      "sha256": "fadcc0bb3a334add54b77ee6521857c9760473940386b2ea1cef1cf578193495",
      "bytes": 5429
    },
    {
      "path": "requirements.json",
      "sha256": "3c0a9496252b14a13cd4cd5b92e8dcb1ab9d363e625ad126453de8e68d3fdd19",
      "bytes": 8289
    },
    {
      "path": "acceptance-criteria.json",
      "sha256": "a4334d9cd22568fe05017942aa5043c1716b02601433cfce351725747f940322",
      "bytes": 1702
    },
    {
      "path": "invariants.json",
      "sha256": "df6149df9a2b0f1a9025c52652138be5ec08b98f5468c5f0e50edca3309bf526",
      "bytes": 4019
    },
    {
      "path": "adrs.json",
      "sha256": "2a8c4d2c0edcc0bdf64aa2e44b9e396f6a5885f67c52c470ca668ed90686ce68",
      "bytes": 669
    },
    {
      "path": "architecture-boundaries.json",
      "sha256": "5efb9dc61a94181a5b9a645ed73b183cf227e7b2a19f075ef745688c49daad17",
      "bytes": 429
    },
    {
      "path": "dependency-outputs.json",
      "sha256": "16b2f9a574f0870662cf5dfdd09c20574a21aaa20a430b265dc21368fb8453d9",
      "bytes": 887
    },
    {
      "path": "public-schemas.json",
      "sha256": "0cc16c4a3ba24aebf43a391c845078b93ae2b16008d471ed66dd849cfaa0e9b5",
      "bytes": 171
    },
    {
      "path": "semantic-fields.json",
      "sha256": "54b67c0102778ddecfc62e969751e98ec17d8953596b148f6c080647b707981e",
      "bytes": 426
    },
    {
      "path": "pre-mortem.json",
      "sha256": "e72a565d750ab0204767159fbbb82ece99afdc117c064fc74d710cf6e7f5b9cb",
      "bytes": 260
    },
    {
      "path": "source-references.json",
      "sha256": "39afa2b93bde5c32c6e8edfebb0fde772b4c8a99d0cb46c9bdc16e206ee7ec72",
      "bytes": 519
    }
  ],
  "generatedAt": "2026-07-20T00:00:00Z"
}
